{
  "id": "tx-seed-l2-125",
  "formatVersion": "1.5.0",
  "level": "L2",
  "titleTarget": "آسمان شب",
  "titleTranslit": "āsmān-e shab",
  "titleEn": "The night sky",
  "sentences": [
    {
      "target": "شام است و آسمان تاریک می‌شود.",
      "translit": "shām ast wa āsmān tārīk mēshawad.",
      "en": "It is evening and the sky gets dark.",
      "tokens": [
        {
          "surface": "شام",
          "lexemeId": "lx-6131"
        },
        {
          "surface": "است",
          "lexemeId": "lx-0010"
        },
        {
          "surface": "و",
          "lexemeId": "lx-0001"
        },
        {
          "surface": "آسمان",
          "lexemeId": "lx-0147"
        },
        {
          "surface": "تاریک",
          "lexemeId": "lx-0195"
        },
        {
          "surface": "می‌شود",
          "lexemeId": "lx-0149"
        }
      ]
    },
    {
      "target": "آسمان شب بسیار مقبول است.",
      "translit": "āsmān-e shab bisyār maqbūl ast.",
      "en": "The night sky is very beautiful.",
      "tokens": [
        {
          "surface": "آسمان",
          "lexemeId": "lx-0147"
        },
        {
          "surface": "شب",
          "lexemeId": "lx-0041"
        },
        {
          "surface": "بسیار",
          "lexemeId": "lx-0167"
        },
        {
          "surface": "مقبول",
          "lexemeId": "lx-0073"
        },
        {
          "surface": "است",
          "lexemeId": "lx-0010"
        }
      ]
    },
    {
      "target": "ما بعد از شام در حویلی می‌نشینیم.",
      "translit": "mā ba'd az shām dar hawēlī mēnishīnēm.",
      "en": "After dinner we sit in the courtyard.",
      "tokens": [
        {
          "surface": "ما",
          "lexemeId": "lx-0014"
        },
        {
          "surface": "بعد",
          "lexemeId": "lx-0301"
        },
        {
          "surface": "از",
          "lexemeId": "lx-0004"
        },
        {
          "surface": "شام",
          "lexemeId": "lx-6131"
        },
        {
          "surface": "در",
          "lexemeId": "lx-0002"
        },
        {
          "surface": "حویلی",
          "lexemeId": "lx-6048"
        },
        {
          "surface": "می‌نشینیم",
          "lexemeId": "lx-0160"
        }
      ]
    },
    {
      "target": "دیوار حویلی بلند است.",
      "translit": "dēwār-e hawēlī buland ast.",
      "en": "The courtyard wall is tall.",
      "tokens": [
        {
          "surface": "دیوار",
          "lexemeId": "lx-6045"
        },
        {
          "surface": "حویلی",
          "lexemeId": "lx-6048"
        },
        {
          "surface": "بلند",
          "lexemeId": "lx-0226"
        },
        {
          "surface": "است",
          "lexemeId": "lx-0010"
        }
      ]
    },
    {
      "target": "مادر من شام را می‌پزد.",
      "translit": "mādar-e man shām rā mēpazad.",
      "en": "My mother cooks the dinner.",
      "tokens": [
        {
          "surface": "مادر",
          "lexemeId": "lx-0051"
        },
        {
          "surface": "من",
          "lexemeId": "lx-0011"
        },
        {
          "surface": "شام",
          "lexemeId": "lx-6131"
        },
        {
          "surface": "را",
          "lexemeId": "lx-0007"
        },
        {
          "surface": "می‌پزد",
          "lexemeId": "lx-0385"
        }
      ]
    }
  ],
  "vocabUsed": [
    "lx-0001",
    "lx-0002",
    "lx-0004",
    "lx-0007",
    "lx-0010",
    "lx-0011",
    "lx-0014",
    "lx-0041",
    "lx-0051",
    "lx-0073",
    "lx-0147",
    "lx-0149",
    "lx-0160",
    "lx-0167",
    "lx-0195",
    "lx-0226",
    "lx-0301",
    "lx-0385",
    "lx-6045",
    "lx-6048",
    "lx-6131"
  ],
  "newWords": [],
  "questions": [],
  "grammarPoints": [],
  "newWordRatio": 0,
  "source": "seed",
  "createdAt": "2026-07-20T00:00:00.000Z",
  "seq": 125
}
