{
  "id": "tx-seed-l2-067",
  "formatVersion": "1.5.0",
  "level": "L2",
  "titleTarget": "داکتر",
  "titleTranslit": "dāktar",
  "titleEn": "The doctor",
  "sentences": [
    {
      "target": "حال من امروز خوب نیست.",
      "translit": "hāl-e man imrōz khūb nēst.",
      "en": "My condition is not good today.",
      "tokens": [
        {
          "surface": "حال",
          "lexemeId": "lx-0325"
        },
        {
          "surface": "من",
          "lexemeId": "lx-0011"
        },
        {
          "surface": "امروز",
          "lexemeId": "lx-0043"
        },
        {
          "surface": "خوب",
          "lexemeId": "lx-0063"
        },
        {
          "surface": "نیست",
          "lexemeId": "lx-0096"
        }
      ]
    },
    {
      "target": "چشم من درد می‌کند.",
      "translit": "chashm-e man dard mēkunad.",
      "en": "My eye hurts.",
      "tokens": [
        {
          "surface": "چشم",
          "lexemeId": "lx-0123"
        },
        {
          "surface": "من",
          "lexemeId": "lx-0011"
        },
        {
          "surface": "درد",
          "lexemeId": "lx-0209"
        },
        {
          "surface": "می‌کند",
          "lexemeId": "lx-0097"
        }
      ]
    },
    {
      "target": "من به داکتر می‌روم.",
      "translit": "man ba dāktar mērawam.",
      "en": "I go to the doctor.",
      "tokens": [
        {
          "surface": "من",
          "lexemeId": "lx-0011"
        },
        {
          "surface": "به",
          "lexemeId": "lx-0003"
        },
        {
          "surface": "داکتر",
          "lexemeId": "lx-0210"
        },
        {
          "surface": "می‌روم",
          "lexemeId": "lx-0089"
        }
      ]
    },
    {
      "target": "داکتر حال من را می‌فهمد.",
      "translit": "dāktar hāl-e man rā mēfahmad.",
      "en": "The doctor understands my condition.",
      "tokens": [
        {
          "surface": "داکتر",
          "lexemeId": "lx-0210"
        },
        {
          "surface": "حال",
          "lexemeId": "lx-0325"
        },
        {
          "surface": "من",
          "lexemeId": "lx-0011"
        },
        {
          "surface": "را",
          "lexemeId": "lx-0007"
        },
        {
          "surface": "می‌فهمد",
          "lexemeId": "lx-0157"
        }
      ]
    },
    {
      "target": "داکتر می‌گوید: من مانده هستم.",
      "translit": "dāktar mēgōyad: man mānda hastam.",
      "en": "The doctor says: I am tired.",
      "tokens": [
        {
          "surface": "داکتر",
          "lexemeId": "lx-0210"
        },
        {
          "surface": "می‌گوید",
          "lexemeId": "lx-0093"
        },
        {
          "surface": "من",
          "lexemeId": "lx-0011"
        },
        {
          "surface": "مانده",
          "lexemeId": "lx-0108"
        },
        {
          "surface": "هستم",
          "lexemeId": "lx-0096"
        }
      ]
    }
  ],
  "vocabUsed": [
    "lx-0003",
    "lx-0007",
    "lx-0011",
    "lx-0043",
    "lx-0063",
    "lx-0089",
    "lx-0093",
    "lx-0096",
    "lx-0097",
    "lx-0108",
    "lx-0123",
    "lx-0157",
    "lx-0209",
    "lx-0210",
    "lx-0325"
  ],
  "newWords": [
    "lx-0157"
  ],
  "questions": [
    {
      "questionEn": "What hurts?",
      "questionTarget": "چه درد می‌کند؟",
      "questionTranslit": "chi dard mēkunad?",
      "options": [
        {
          "target": "سر من",
          "translit": "sar-e man",
          "en": "My head"
        },
        {
          "target": "چشم من",
          "translit": "chashm-e man",
          "en": "My eye"
        },
        {
          "target": "دست من",
          "translit": "dast-e man",
          "en": "My hand"
        },
        {
          "target": "پای من",
          "translit": "pā-ye man",
          "en": "My leg"
        }
      ],
      "answerIndex": 1,
      "evidenceSentence": 1,
      "source": "authored"
    },
    {
      "questionEn": "Where do I go?",
      "questionTarget": "من به کجا می‌روم؟",
      "questionTranslit": "man ba kujā mērawam?",
      "options": [
        {
          "target": "به بازار",
          "translit": "ba bāzār",
          "en": "To the market"
        },
        {
          "target": "به خانه",
          "translit": "ba khāna",
          "en": "Home"
        },
        {
          "target": "به مکتب",
          "translit": "ba maktab",
          "en": "To school"
        },
        {
          "target": "به داکتر",
          "translit": "ba dāktar",
          "en": "To the doctor"
        }
      ],
      "answerIndex": 3,
      "evidenceSentence": 2,
      "source": "authored"
    }
  ],
  "grammarPoints": [
    "ezafa-possession",
    "present-me",
    "object-ra",
    "negation"
  ],
  "newWordRatio": 0,
  "source": "seed",
  "createdAt": "2026-07-20T00:00:00.000Z",
  "seq": 67
}
