{
  "id": "tx-seed-l2-044",
  "formatVersion": "1.5.0",
  "level": "L2",
  "titleTarget": "رفتن به مسجد",
  "titleTranslit": "raftan ba masjid",
  "titleEn": "Going to the mosque",
  "sentences": [
    {
      "target": "پدرم روز جمعه به مسجد می‌رود.",
      "translit": "padar-am rōz-e jum'a ba masjid mērawad.",
      "en": "My father goes to the mosque on Friday.",
      "tokens": [
        {
          "surface": "پدرم",
          "lexemeId": "lx-0052"
        },
        {
          "surface": "روز",
          "lexemeId": "lx-0040"
        },
        {
          "surface": "جمعه",
          "lexemeId": "lx-6068"
        },
        {
          "surface": "به",
          "lexemeId": "lx-0003"
        },
        {
          "surface": "مسجد",
          "lexemeId": "lx-0135"
        },
        {
          "surface": "می‌رود",
          "lexemeId": "lx-0089"
        }
      ]
    },
    {
      "target": "او با همسایه‌ها یکجا نماز می‌خواند.",
      "translit": "ō bā hamsāya-hā yakjā namāz mēkhānad.",
      "en": "He prays together with the neighbors.",
      "tokens": [
        {
          "surface": "او",
          "lexemeId": "lx-0012"
        },
        {
          "surface": "با",
          "lexemeId": "lx-0008"
        },
        {
          "surface": "همسایه‌ها",
          "lexemeId": "lx-0255"
        },
        {
          "surface": "یکجا",
          "lexemeId": "lx-6105"
        },
        {
          "surface": "نماز",
          "lexemeId": "lx-6253"
        },
        {
          "surface": "می‌خواند",
          "lexemeId": "lx-0098"
        }
      ]
    },
    {
      "target": "مسجد قریه ما تازه رنگ شده است.",
      "translit": "masjid-e qarya-ye mā tāza rang shuda ast.",
      "en": "The mosque of our village has been freshly painted.",
      "tokens": [
        {
          "surface": "مسجد",
          "lexemeId": "lx-0135"
        },
        {
          "surface": "قریه",
          "lexemeId": "lx-0081"
        },
        {
          "surface": "ما",
          "lexemeId": "lx-0014"
        },
        {
          "surface": "تازه",
          "lexemeId": "lx-0204"
        },
        {
          "surface": "رنگ",
          "lexemeId": "lx-0141"
        },
        {
          "surface": "شده",
          "lexemeId": "lx-0149"
        },
        {
          "surface": "است",
          "lexemeId": "lx-0010"
        }
      ]
    },
    {
      "target": "صدای اذان بسیار بلند است.",
      "translit": "sadā-ye azān bisyār buland ast.",
      "en": "The sound of the call to prayer is very loud.",
      "tokens": [
        {
          "surface": "صدای",
          "lexemeId": "lx-6294"
        },
        {
          "surface": "اذان",
          "lexemeId": "lx-6254"
        },
        {
          "surface": "بسیار",
          "lexemeId": "lx-0167"
        },
        {
          "surface": "بلند",
          "lexemeId": "lx-0226"
        },
        {
          "surface": "است",
          "lexemeId": "lx-0010"
        }
      ]
    }
  ],
  "vocabUsed": [
    "lx-0003",
    "lx-0008",
    "lx-0010",
    "lx-0012",
    "lx-0014",
    "lx-0040",
    "lx-0052",
    "lx-0081",
    "lx-0089",
    "lx-0098",
    "lx-0135",
    "lx-0141",
    "lx-0149",
    "lx-0167",
    "lx-0204",
    "lx-0226",
    "lx-0255",
    "lx-6068",
    "lx-6105",
    "lx-6253",
    "lx-6254",
    "lx-6294"
  ],
  "newWords": [
    "lx-0135",
    "lx-6253",
    "lx-6254",
    "lx-6294"
  ],
  "questions": [
    {
      "questionEn": "Where does my father go on Friday?",
      "questionTarget": "پدرم روز جمعه کجا می‌رود؟",
      "questionTranslit": "padar-am rōz-e jum'a kujā mērawad?",
      "options": [
        {
          "target": "به بازار",
          "translit": "ba bāzār",
          "en": "To the market"
        },
        {
          "target": "به مسجد",
          "translit": "ba masjid",
          "en": "To the mosque"
        },
        {
          "target": "به دکان",
          "translit": "ba dukān",
          "en": "To the shop"
        },
        {
          "target": "به قریه",
          "translit": "ba qarya",
          "en": "To the village"
        }
      ],
      "answerIndex": 1,
      "evidenceSentence": 0,
      "source": "authored"
    },
    {
      "questionEn": "Who does he pray with?",
      "questionTarget": "او با کی نماز می‌خواند؟",
      "questionTranslit": "ō bā kī namāz mēkhānad?",
      "options": [
        {
          "target": "با بچه‌ها",
          "translit": "bā bacha-hā",
          "en": "With the children"
        },
        {
          "target": "با برادر خود",
          "translit": "bā barādar-e khud",
          "en": "With his own brother"
        },
        {
          "target": "با همسایه‌ها",
          "translit": "bā hamsāya-hā",
          "en": "With the neighbours"
        },
        {
          "target": "با معلم",
          "translit": "bā mu'allem",
          "en": "With the teacher"
        }
      ],
      "answerIndex": 2,
      "evidenceSentence": 1,
      "source": "authored"
    }
  ],
  "grammarPoints": [
    "present-me",
    "ezafa-possession",
    "plural-ha",
    "present-perfect"
  ],
  "newWordRatio": 0,
  "source": "seed",
  "createdAt": "2026-07-20T00:00:00.000Z",
  "seq": 44
}
