{
  "id": "tx-seed-l2-035",
  "formatVersion": "1.5.0",
  "level": "L2",
  "titleTarget": "دکان خیاط",
  "titleTranslit": "dukān-e khayyāt",
  "titleEn": "The tailor's shop",
  "sentences": [
    {
      "target": "خیاط لباس‌های زمستانی می‌دوزد.",
      "translit": "khayyāt libās-hā-ye zimistānī mēdōzad.",
      "en": "The tailor sews winter clothes.",
      "tokens": [
        {
          "surface": "خیاط",
          "lexemeId": "lx-0504"
        },
        {
          "surface": "لباس‌های",
          "lexemeId": "lx-0230"
        },
        {
          "surface": "زمستانی",
          "lexemeId": "lx-0131"
        },
        {
          "surface": "می‌دوزد",
          "lexemeId": "lx-0468"
        }
      ]
    },
    {
      "target": "من برای خود یک کرتی فرمایش دادم.",
      "translit": "man barā-ye khud yak kurtī farmāyish dādam.",
      "en": "I ordered a jacket for myself.",
      "tokens": [
        {
          "surface": "من",
          "lexemeId": "lx-0011"
        },
        {
          "surface": "برای",
          "lexemeId": "lx-0299"
        },
        {
          "surface": "خود",
          "lexemeId": "lx-0178"
        },
        {
          "surface": "یک",
          "lexemeId": "lx-0025"
        },
        {
          "surface": "کرتی",
          "lexemeId": "lx-6226"
        },
        {
          "surface": "فرمایش",
          "lexemeId": "lx-6235"
        },
        {
          "surface": "دادم",
          "lexemeId": "lx-0100"
        }
      ]
    },
    {
      "target": "رنگ آن سیاه و تاریک است.",
      "translit": "rang-e ān siyāh wa tārīk ast.",
      "en": "Its color is dark black.",
      "tokens": [
        {
          "surface": "رنگ",
          "lexemeId": "lx-0141"
        },
        {
          "surface": "آن",
          "lexemeId": "lx-0009"
        },
        {
          "surface": "سیاه",
          "lexemeId": "lx-0144"
        },
        {
          "surface": "و",
          "lexemeId": "lx-0001"
        },
        {
          "surface": "تاریک",
          "lexemeId": "lx-0195"
        },
        {
          "surface": "است",
          "lexemeId": "lx-0010"
        }
      ]
    },
    {
      "target": "هفته آینده آن را می‌پوشم.",
      "translit": "hafta-ye āyanda ān rā mēpōsham.",
      "en": "Next week I will wear it.",
      "tokens": [
        {
          "surface": "هفته",
          "lexemeId": "lx-0050"
        },
        {
          "surface": "آینده",
          "lexemeId": "lx-1050"
        },
        {
          "surface": "آن",
          "lexemeId": "lx-0009"
        },
        {
          "surface": "را",
          "lexemeId": "lx-0007"
        },
        {
          "surface": "می‌پوشم",
          "lexemeId": "lx-0231"
        }
      ]
    }
  ],
  "vocabUsed": [
    "lx-0001",
    "lx-0007",
    "lx-0009",
    "lx-0010",
    "lx-0011",
    "lx-0025",
    "lx-0050",
    "lx-0100",
    "lx-0131",
    "lx-0141",
    "lx-0144",
    "lx-0178",
    "lx-0195",
    "lx-0230",
    "lx-0231",
    "lx-0299",
    "lx-0468",
    "lx-0504",
    "lx-1050",
    "lx-6226",
    "lx-6235"
  ],
  "newWords": [
    "lx-0050",
    "lx-0100",
    "lx-0144",
    "lx-0195",
    "lx-0468",
    "lx-0504",
    "lx-6226",
    "lx-6235"
  ],
  "questions": [
    {
      "questionEn": "What does the tailor sew?",
      "questionTarget": "خیاط چه می‌دوزد؟",
      "questionTranslit": "khayyāt chi mēdōzad?",
      "options": [
        {
          "target": "خریطه‌ها",
          "translit": "kharīta-hā",
          "en": "Bags"
        },
        {
          "target": "لباس‌های بچه‌ها",
          "translit": "libās-hā-ye bacha-hā",
          "en": "Children's clothes"
        },
        {
          "target": "لباس‌های زمستانی",
          "translit": "libās-hā-ye zimistānī",
          "en": "Winter clothes"
        },
        {
          "target": "بوت‌های نو",
          "translit": "būt-hā-ye naw",
          "en": "New shoes"
        }
      ],
      "answerIndex": 2,
      "evidenceSentence": 0,
      "source": "authored"
    },
    {
      "questionEn": "What colour is the jacket?",
      "questionTarget": "رنگ کرتی چیست؟",
      "questionTranslit": "rang-e kurtī chēst?",
      "options": [
        {
          "target": "سفید",
          "translit": "safēd",
          "en": "White"
        },
        {
          "target": "سرخ",
          "translit": "surkh",
          "en": "Red"
        },
        {
          "target": "سیاه",
          "translit": "siyāh",
          "en": "Black"
        },
        {
          "target": "آبی",
          "translit": "ābī",
          "en": "Blue"
        }
      ],
      "answerIndex": 2,
      "evidenceSentence": 2,
      "source": "authored"
    }
  ],
  "grammarPoints": [
    "present-me",
    "simple-past",
    "plural-ha",
    "object-ra",
    "future-with-present"
  ],
  "newWordRatio": 0,
  "source": "seed",
  "createdAt": "2026-07-20T00:00:00.000Z",
  "seq": 35
}
