{
  "id": "tx-seed-l2-040",
  "formatVersion": "1.5.0",
  "level": "L2",
  "titleTarget": "سگ همسایه",
  "titleTranslit": "sag-e hamsāya",
  "titleEn": "The neighbor dog",
  "sentences": [
    {
      "target": "سگ همسایه بسیار غالمغال می‌کند.",
      "translit": "sag-e hamsāya bisyār ghālmaghāl mēkunad.",
      "en": "The neighbor dog makes a lot of noise.",
      "tokens": [
        {
          "surface": "سگ",
          "lexemeId": "lx-0480"
        },
        {
          "surface": "همسایه",
          "lexemeId": "lx-0255"
        },
        {
          "surface": "بسیار",
          "lexemeId": "lx-0167"
        },
        {
          "surface": "غالمغال",
          "lexemeId": "lx-6248"
        },
        {
          "surface": "می‌کند",
          "lexemeId": "lx-0097"
        }
      ]
    },
    {
      "target": "آن سگ کلان و سیاه است.",
      "translit": "ān sag kalān wa siyāh ast.",
      "en": "That dog is big and black.",
      "tokens": [
        {
          "surface": "آن",
          "lexemeId": "lx-0009"
        },
        {
          "surface": "سگ",
          "lexemeId": "lx-0480"
        },
        {
          "surface": "کلان",
          "lexemeId": "lx-0065"
        },
        {
          "surface": "و",
          "lexemeId": "lx-0001"
        },
        {
          "surface": "سیاه",
          "lexemeId": "lx-0144"
        },
        {
          "surface": "است",
          "lexemeId": "lx-0010"
        }
      ]
    },
    {
      "target": "بچه‌ها از او می‌ترسند.",
      "translit": "bacha-hā az ō mētarsand.",
      "en": "The children are afraid of him.",
      "tokens": [
        {
          "surface": "بچه‌ها",
          "lexemeId": "lx-0057"
        },
        {
          "surface": "از",
          "lexemeId": "lx-0004"
        },
        {
          "surface": "او",
          "lexemeId": "lx-0012"
        },
        {
          "surface": "می‌ترسند",
          "lexemeId": "lx-0366"
        }
      ]
    },
    {
      "target": "صاحبش او را در حویلی بسته است.",
      "translit": "sāhib-ash ō rā dar hawēlī basta ast.",
      "en": "His owner has tied him in the yard.",
      "tokens": [
        {
          "surface": "صاحبش",
          "lexemeId": "lx-6249"
        },
        {
          "surface": "او",
          "lexemeId": "lx-0012"
        },
        {
          "surface": "را",
          "lexemeId": "lx-0007"
        },
        {
          "surface": "در",
          "lexemeId": "lx-0002"
        },
        {
          "surface": "حویلی",
          "lexemeId": "lx-6048"
        },
        {
          "surface": "بسته",
          "lexemeId": "lx-0200"
        },
        {
          "surface": "است",
          "lexemeId": "lx-0010"
        }
      ]
    }
  ],
  "vocabUsed": [
    "lx-0001",
    "lx-0002",
    "lx-0004",
    "lx-0007",
    "lx-0009",
    "lx-0010",
    "lx-0012",
    "lx-0057",
    "lx-0065",
    "lx-0097",
    "lx-0144",
    "lx-0167",
    "lx-0200",
    "lx-0255",
    "lx-0366",
    "lx-0480",
    "lx-6048",
    "lx-6248",
    "lx-6249"
  ],
  "newWords": [
    "lx-0200",
    "lx-0255",
    "lx-0366",
    "lx-0480",
    "lx-6048",
    "lx-6248",
    "lx-6249"
  ],
  "questions": [
    {
      "questionEn": "What colour is that dog?",
      "questionTarget": "آن سگ چه رنگ است؟",
      "questionTranslit": "ān sag chi rang ast?",
      "options": [
        {
          "target": "سیاه",
          "translit": "siyāh",
          "en": "Black"
        },
        {
          "target": "سرخ",
          "translit": "surkh",
          "en": "Red"
        },
        {
          "target": "زرد",
          "translit": "zard",
          "en": "Yellow"
        },
        {
          "target": "سفید",
          "translit": "safēd",
          "en": "White"
        }
      ],
      "answerIndex": 0,
      "evidenceSentence": 1,
      "source": "authored"
    },
    {
      "questionEn": "Where has the owner tied the dog?",
      "questionTarget": "صاحبش سگ را در کجا بسته است؟",
      "questionTranslit": "sāhib-ash sag rā dar kujā basta ast?",
      "options": [
        {
          "target": "در خانه",
          "translit": "dar khāna",
          "en": "In the house"
        },
        {
          "target": "در دکان",
          "translit": "dar dukān",
          "en": "In the shop"
        },
        {
          "target": "در حویلی",
          "translit": "dar hawēlī",
          "en": "In the yard"
        },
        {
          "target": "در کوچه",
          "translit": "dar kōcha",
          "en": "In the alley"
        }
      ],
      "answerIndex": 2,
      "evidenceSentence": 3,
      "source": "authored"
    }
  ],
  "grammarPoints": [
    "present-me",
    "object-ra",
    "ezafa-possession",
    "demonstratives",
    "plural-ha"
  ],
  "newWordRatio": 0,
  "source": "seed",
  "createdAt": "2026-07-20T00:00:00.000Z",
  "seq": 40
}
