{
  "id": "tx-seed-l1-007",
  "formatVersion": "1.5.0",
  "level": "L1",
  "titleTarget": "خانه آبی",
  "titleTranslit": "khāna-ye ābī",
  "titleEn": "The blue house",
  "sentences": [
    {
      "target": "خانه ما آبی است.",
      "translit": "khāna-ye mā ābī ast.",
      "en": "Our house is blue.",
      "tokens": [
        {
          "surface": "خانه",
          "lexemeId": "lx-0036"
        },
        {
          "surface": "ما",
          "lexemeId": "lx-0014"
        },
        {
          "surface": "آبی",
          "lexemeId": "lx-0146"
        },
        {
          "surface": "است",
          "lexemeId": "lx-0010"
        }
      ]
    },
    {
      "target": "من به خانه نگاه می‌کنم.",
      "translit": "man ba khāna nigāh mēkunam.",
      "en": "I look at the house.",
      "tokens": [
        {
          "surface": "من",
          "lexemeId": "lx-0011"
        },
        {
          "surface": "به",
          "lexemeId": "lx-0003"
        },
        {
          "surface": "خانه",
          "lexemeId": "lx-0036"
        },
        {
          "surface": "نگاه",
          "lexemeId": "lx-0316"
        },
        {
          "surface": "می‌کنم",
          "lexemeId": "lx-0097"
        }
      ]
    },
    {
      "target": "خانه روشن است.",
      "translit": "khāna rōshan ast.",
      "en": "The house is bright.",
      "tokens": [
        {
          "surface": "خانه",
          "lexemeId": "lx-0036"
        },
        {
          "surface": "روشن",
          "lexemeId": "lx-0194"
        },
        {
          "surface": "است",
          "lexemeId": "lx-0010"
        }
      ]
    },
    {
      "target": "خانه سبز نیست.",
      "translit": "khāna sabz nēst.",
      "en": "The house isn't green.",
      "tokens": [
        {
          "surface": "خانه",
          "lexemeId": "lx-0036"
        },
        {
          "surface": "سبز",
          "lexemeId": "lx-0145"
        },
        {
          "surface": "نیست",
          "lexemeId": "lx-0096"
        }
      ]
    },
    {
      "target": "خانه سرخ نیست.",
      "translit": "khāna surkh nēst.",
      "en": "The house isn't red.",
      "tokens": [
        {
          "surface": "خانه",
          "lexemeId": "lx-0036"
        },
        {
          "surface": "سرخ",
          "lexemeId": "lx-0142"
        },
        {
          "surface": "نیست",
          "lexemeId": "lx-0096"
        }
      ]
    }
  ],
  "vocabUsed": [
    "lx-0003",
    "lx-0010",
    "lx-0011",
    "lx-0014",
    "lx-0036",
    "lx-0096",
    "lx-0097",
    "lx-0142",
    "lx-0145",
    "lx-0146",
    "lx-0194",
    "lx-0316"
  ],
  "newWords": [
    "lx-0142",
    "lx-0145",
    "lx-0146",
    "lx-0194",
    "lx-0316"
  ],
  "questions": [
    {
      "questionEn": "What colour is our house?",
      "questionTarget": "رنگ خانه ما چه است؟",
      "questionTranslit": "rang-e khāna-ye mā chē ast?",
      "options": [
        {
          "target": "سبز",
          "translit": "sabz",
          "en": "Green"
        },
        {
          "target": "آبی",
          "translit": "ābī",
          "en": "Blue"
        },
        {
          "target": "سرخ",
          "translit": "surkh",
          "en": "Red"
        },
        {
          "target": "زرد",
          "translit": "zard",
          "en": "Yellow"
        }
      ],
      "answerIndex": 1,
      "evidenceSentence": 0,
      "source": "authored"
    },
    {
      "questionEn": "How is the house?",
      "questionTarget": "خانه چطور است؟",
      "questionTranslit": "khāna chitōr ast?",
      "options": [
        {
          "target": "تاریک",
          "translit": "tārīk",
          "en": "Dark"
        },
        {
          "target": "کلان",
          "translit": "kalān",
          "en": "Big"
        },
        {
          "target": "روشن",
          "translit": "rōshan",
          "en": "Bright"
        },
        {
          "target": "کهنه",
          "translit": "kuhna",
          "en": "Old"
        }
      ],
      "answerIndex": 2,
      "evidenceSentence": 2,
      "source": "authored"
    }
  ],
  "grammarPoints": [
    "present-me",
    "negation",
    "ezafa-possession",
    "pronouns-budan"
  ],
  "newWordRatio": 0,
  "source": "seed",
  "createdAt": "2026-07-20T00:00:00.000Z",
  "seq": 7
}
