{
  "id": "tx-seed-l2-015",
  "formatVersion": "1.5.0",
  "level": "L2",
  "titleTarget": "خانم مشهور",
  "titleTranslit": "khānum-e mashhūr",
  "titleEn": "Famous lady",
  "sentences": [
    {
      "target": "یک اتفاق کلان است.",
      "translit": "yak ittifāq-e kalān ast.",
      "en": "It is a big event.",
      "tokens": [
        {
          "surface": "یک",
          "lexemeId": "lx-0025"
        },
        {
          "surface": "اتفاق",
          "lexemeId": "lx-0359"
        },
        {
          "surface": "کلان",
          "lexemeId": "lx-0065"
        },
        {
          "surface": "است",
          "lexemeId": "lx-0010"
        }
      ]
    },
    {
      "target": "اتفاق خوبی بود.",
      "translit": "ittifāq-e khūbē būd.",
      "en": "It was a good event.",
      "tokens": [
        {
          "surface": "اتفاق",
          "lexemeId": "lx-0359"
        },
        {
          "surface": "خوبی",
          "lexemeId": "lx-0063"
        },
        {
          "surface": "بود",
          "lexemeId": "lx-0096"
        }
      ]
    },
    {
      "target": "خانم یک نامه می‌فرستد.",
      "translit": "khānum yak nāma mēfiristad.",
      "en": "The lady sends a letter.",
      "tokens": [
        {
          "surface": "خانم",
          "lexemeId": "lx-0323"
        },
        {
          "surface": "یک",
          "lexemeId": "lx-0025"
        },
        {
          "surface": "نامه",
          "lexemeId": "lx-6008"
        },
        {
          "surface": "می‌فرستد",
          "lexemeId": "lx-0377"
        }
      ]
    },
    {
      "target": "خانم آن را می‌فرستد.",
      "translit": "khānum ān rā mēfiristad.",
      "en": "The lady sends it.",
      "tokens": [
        {
          "surface": "خانم",
          "lexemeId": "lx-0323"
        },
        {
          "surface": "آن",
          "lexemeId": "lx-0009"
        },
        {
          "surface": "را",
          "lexemeId": "lx-0007"
        },
        {
          "surface": "می‌فرستد",
          "lexemeId": "lx-0377"
        }
      ]
    },
    {
      "target": "او از خانم مشهور می‌آموزد.",
      "translit": "ō az khānum-e mashhūr mēāmōzad.",
      "en": "He learns from the famous lady.",
      "tokens": [
        {
          "surface": "او",
          "lexemeId": "lx-0012"
        },
        {
          "surface": "از",
          "lexemeId": "lx-0004"
        },
        {
          "surface": "خانم",
          "lexemeId": "lx-0323"
        },
        {
          "surface": "مشهور",
          "lexemeId": "lx-0228"
        },
        {
          "surface": "می‌آموزد",
          "lexemeId": "lx-0383"
        }
      ]
    },
    {
      "target": "این خانم بسیار مشهور است.",
      "translit": "īn khānum bisyār mashhūr ast.",
      "en": "This lady is very famous.",
      "tokens": [
        {
          "surface": "این",
          "lexemeId": "lx-0006"
        },
        {
          "surface": "خانم",
          "lexemeId": "lx-0323"
        },
        {
          "surface": "بسیار",
          "lexemeId": "lx-0167"
        },
        {
          "surface": "مشهور",
          "lexemeId": "lx-0228"
        },
        {
          "surface": "است",
          "lexemeId": "lx-0010"
        }
      ]
    }
  ],
  "vocabUsed": [
    "lx-0004",
    "lx-0006",
    "lx-0007",
    "lx-0009",
    "lx-0010",
    "lx-0012",
    "lx-0025",
    "lx-0063",
    "lx-0065",
    "lx-0096",
    "lx-0167",
    "lx-0228",
    "lx-0323",
    "lx-0359",
    "lx-0377",
    "lx-0383",
    "lx-6008"
  ],
  "newWords": [
    "lx-0228",
    "lx-0323",
    "lx-0359",
    "lx-0377",
    "lx-0383",
    "lx-6008"
  ],
  "questions": [
    {
      "questionEn": "What does the lady send?",
      "questionTarget": "خانم چه می‌فرستد؟",
      "questionTranslit": "khānum chi mēfiristad?",
      "options": [
        {
          "target": "یک نامه",
          "translit": "yak nāma",
          "en": "A letter"
        },
        {
          "target": "یک کتاب",
          "translit": "yak kitāb",
          "en": "A book"
        },
        {
          "target": "یک عکس",
          "translit": "yak aks",
          "en": "A photo"
        },
        {
          "target": "یک خریطه",
          "translit": "yak kharīta",
          "en": "A bag"
        }
      ],
      "answerIndex": 0,
      "evidenceSentence": 2,
      "source": "authored"
    },
    {
      "questionEn": "Who does he learn from?",
      "questionTarget": "او از کی می‌آموزد؟",
      "questionTranslit": "ō az kī mēāmōzad?",
      "options": [
        {
          "target": "از معلم",
          "translit": "az mu'allim",
          "en": "From the teacher"
        },
        {
          "target": "از پدر خود",
          "translit": "az padar-e khud",
          "en": "From his own father"
        },
        {
          "target": "از خانم مشهور",
          "translit": "az khānum-e mash'hūr",
          "en": "From the famous lady"
        },
        {
          "target": "از همسایه",
          "translit": "az hamsāya",
          "en": "From the neighbour"
        }
      ],
      "answerIndex": 2,
      "evidenceSentence": 4,
      "source": "authored"
    }
  ],
  "grammarPoints": [
    "present-me",
    "simple-past",
    "object-ra",
    "ezafa-adjectives"
  ],
  "newWordRatio": 0,
  "source": "seed",
  "createdAt": "2026-07-20T00:00:00.000Z",
  "seq": 15
}
