{
  "id": "tx-seed-l2-022",
  "formatVersion": "1.5.0",
  "level": "L2",
  "titleTarget": "مهمان",
  "titleTranslit": "mihmān",
  "titleEn": "Guest",
  "sentences": [
    {
      "target": "مهمان عشق خود را می‌بازد.",
      "translit": "mihmān ishq-e khud rā mēbāzad.",
      "en": "The guest loses his love.",
      "tokens": [
        {
          "surface": "مهمان",
          "lexemeId": "lx-0188"
        },
        {
          "surface": "عشق",
          "lexemeId": "lx-0496"
        },
        {
          "surface": "خود",
          "lexemeId": "lx-0178"
        },
        {
          "surface": "را",
          "lexemeId": "lx-0007"
        },
        {
          "surface": "می‌بازد",
          "lexemeId": "lx-0474"
        }
      ]
    },
    {
      "target": "او یک موتر می‌دزدد.",
      "translit": "ō yak mōtar mēduzdad.",
      "en": "He steals a car.",
      "tokens": [
        {
          "surface": "او",
          "lexemeId": "lx-0012"
        },
        {
          "surface": "یک",
          "lexemeId": "lx-0025"
        },
        {
          "surface": "موتر",
          "lexemeId": "lx-0083"
        },
        {
          "surface": "می‌دزدد",
          "lexemeId": "lx-0393"
        }
      ]
    },
    {
      "target": "من او را به شهر می‌رسانم.",
      "translit": "man ō rā ba shahr mērasānam.",
      "en": "I deliver him to the city.",
      "tokens": [
        {
          "surface": "من",
          "lexemeId": "lx-0011"
        },
        {
          "surface": "او",
          "lexemeId": "lx-0012"
        },
        {
          "surface": "را",
          "lexemeId": "lx-0007"
        },
        {
          "surface": "به",
          "lexemeId": "lx-0003"
        },
        {
          "surface": "شهر",
          "lexemeId": "lx-0080"
        },
        {
          "surface": "می‌رسانم",
          "lexemeId": "lx-0427"
        }
      ]
    },
    {
      "target": "مهمان موتر را می‌دزدد.",
      "translit": "mihmān mōtar rā mēduzdad.",
      "en": "The guest steals the car.",
      "tokens": [
        {
          "surface": "مهمان",
          "lexemeId": "lx-0188"
        },
        {
          "surface": "موتر",
          "lexemeId": "lx-0083"
        },
        {
          "surface": "را",
          "lexemeId": "lx-0007"
        },
        {
          "surface": "می‌دزدد",
          "lexemeId": "lx-0393"
        }
      ]
    }
  ],
  "vocabUsed": [
    "lx-0003",
    "lx-0007",
    "lx-0011",
    "lx-0012",
    "lx-0025",
    "lx-0080",
    "lx-0083",
    "lx-0178",
    "lx-0188",
    "lx-0393",
    "lx-0427",
    "lx-0474",
    "lx-0496"
  ],
  "newWords": [
    "lx-0083",
    "lx-0188",
    "lx-0393",
    "lx-0427",
    "lx-0474",
    "lx-0496"
  ],
  "questions": [
    {
      "questionEn": "What does the guest steal?",
      "questionTarget": "مهمان چه می‌دزدد؟",
      "questionTranslit": "mihmān chi mēduzdad?",
      "options": [
        {
          "target": "بایسکل",
          "translit": "bāyskil",
          "en": "A bicycle"
        },
        {
          "target": "موتر",
          "translit": "mōtar",
          "en": "A car"
        },
        {
          "target": "کتاب",
          "translit": "kitāb",
          "en": "A book"
        },
        {
          "target": "ساعت",
          "translit": "sā'at",
          "en": "A watch"
        }
      ],
      "answerIndex": 1,
      "evidenceSentence": 3,
      "source": "authored"
    },
    {
      "questionEn": "Where do I deliver him?",
      "questionTarget": "من او را کجا می‌رسانم؟",
      "questionTranslit": "man ō rā kujā mērasānam?",
      "options": [
        {
          "target": "به قریه",
          "translit": "ba qarya",
          "en": "To the village"
        },
        {
          "target": "به خانه",
          "translit": "ba khāna",
          "en": "Home"
        },
        {
          "target": "به شهر",
          "translit": "ba shahr",
          "en": "To the city"
        },
        {
          "target": "به بازار",
          "translit": "ba bāzār",
          "en": "To the market"
        }
      ],
      "answerIndex": 2,
      "evidenceSentence": 2,
      "source": "authored"
    }
  ],
  "grammarPoints": [
    "present-me",
    "object-ra",
    "ezafa-possession",
    "prepositions"
  ],
  "newWordRatio": 0,
  "source": "seed",
  "createdAt": "2026-07-20T00:00:00.000Z",
  "seq": 22
}
