{
  "id": "tx-seed-l1-010",
  "formatVersion": "1.5.0",
  "level": "L1",
  "titleTarget": "زندگی ما",
  "titleTranslit": "zindagī-ye mā",
  "titleEn": "Our life",
  "sentences": [
    {
      "target": "من با چشم می‌بینم.",
      "translit": "man bā chashm mēbīnam.",
      "en": "I see with the eye.",
      "tokens": [
        {
          "surface": "من",
          "lexemeId": "lx-0011"
        },
        {
          "surface": "با",
          "lexemeId": "lx-0008"
        },
        {
          "surface": "چشم",
          "lexemeId": "lx-0123"
        },
        {
          "surface": "می‌بینم",
          "lexemeId": "lx-0092"
        }
      ]
    },
    {
      "target": "سر من درد دارد.",
      "translit": "sar-e man dard dārad.",
      "en": "My head has pain.",
      "tokens": [
        {
          "surface": "سر",
          "lexemeId": "lx-0122"
        },
        {
          "surface": "من",
          "lexemeId": "lx-0011"
        },
        {
          "surface": "درد",
          "lexemeId": "lx-0209"
        },
        {
          "surface": "دارد",
          "lexemeId": "lx-0095"
        }
      ]
    },
    {
      "target": "زندگی خوب است.",
      "translit": "zindagī khūb ast.",
      "en": "Life is good.",
      "tokens": [
        {
          "surface": "زندگی",
          "lexemeId": "lx-0150"
        },
        {
          "surface": "خوب",
          "lexemeId": "lx-0063"
        },
        {
          "surface": "است",
          "lexemeId": "lx-0010"
        }
      ]
    },
    {
      "target": "او یک پای دارد.",
      "translit": "ō yak pāy dārad.",
      "en": "He has one leg.",
      "tokens": [
        {
          "surface": "او",
          "lexemeId": "lx-0012"
        },
        {
          "surface": "یک",
          "lexemeId": "lx-0025"
        },
        {
          "surface": "پای",
          "lexemeId": "lx-0125"
        },
        {
          "surface": "دارد",
          "lexemeId": "lx-0095"
        }
      ]
    }
  ],
  "vocabUsed": [
    "lx-0008",
    "lx-0010",
    "lx-0011",
    "lx-0012",
    "lx-0025",
    "lx-0063",
    "lx-0092",
    "lx-0095",
    "lx-0122",
    "lx-0123",
    "lx-0125",
    "lx-0150",
    "lx-0209"
  ],
  "newWords": [
    "lx-0092",
    "lx-0122",
    "lx-0123",
    "lx-0125",
    "lx-0150",
    "lx-0209"
  ],
  "questions": [
    {
      "questionEn": "With what do I see?",
      "questionTarget": "من با چه می‌بینم؟",
      "questionTranslit": "man bā chi mēbīnam?",
      "options": [
        {
          "target": "با چشم",
          "translit": "bā chashm",
          "en": "With the eye"
        },
        {
          "target": "با گوش",
          "translit": "bā gōsh",
          "en": "With the ear"
        },
        {
          "target": "با دست",
          "translit": "bā dast",
          "en": "With the hand"
        },
        {
          "target": "با بینی",
          "translit": "bā bīnī",
          "en": "With the nose"
        }
      ],
      "answerIndex": 0,
      "evidenceSentence": 0,
      "source": "authored"
    },
    {
      "questionEn": "How many legs does he have?",
      "questionTarget": "او چند پای دارد؟",
      "questionTranslit": "ō chand pāy dārad?",
      "options": [
        {
          "target": "دو",
          "translit": "dū",
          "en": "Two"
        },
        {
          "target": "سه",
          "translit": "sē",
          "en": "Three"
        },
        {
          "target": "یک",
          "translit": "yak",
          "en": "One"
        },
        {
          "target": "چهار",
          "translit": "chār",
          "en": "Four"
        }
      ],
      "answerIndex": 2,
      "evidenceSentence": 3,
      "source": "authored"
    }
  ],
  "grammarPoints": [
    "present-me",
    "ezafa-possession",
    "dashtan-numbers",
    "prepositions",
    "pronouns-budan"
  ],
  "newWordRatio": 0,
  "source": "seed",
  "createdAt": "2026-07-20T00:00:00.000Z",
  "seq": 10
}
