{
  "id": "tx-seed-l1-002",
  "formatVersion": "1.5.0",
  "level": "L1",
  "titleTarget": "روز من",
  "titleTranslit": "rōz-e man",
  "titleEn": "My day",
  "sentences": [
    {
      "target": "صبح چای می‌خورم.",
      "translit": "subh chāy mēkhuram.",
      "en": "In the morning I drink tea.",
      "tokens": [
        {
          "surface": "صبح",
          "lexemeId": "lx-0042"
        },
        {
          "surface": "چای",
          "lexemeId": "lx-0039"
        },
        {
          "surface": "می‌خورم",
          "lexemeId": "lx-0091"
        }
      ]
    },
    {
      "target": "به کار می‌روم.",
      "translit": "ba kār mērawam.",
      "en": "I go to work.",
      "tokens": [
        {
          "surface": "به",
          "lexemeId": "lx-0003"
        },
        {
          "surface": "کار",
          "lexemeId": "lx-0079"
        },
        {
          "surface": "می‌روم",
          "lexemeId": "lx-0089"
        }
      ]
    },
    {
      "target": "شب به خانه می‌آیم.",
      "translit": "shab ba khāna mēāyam.",
      "en": "At night I come home.",
      "tokens": [
        {
          "surface": "شب",
          "lexemeId": "lx-0041"
        },
        {
          "surface": "به",
          "lexemeId": "lx-0003"
        },
        {
          "surface": "خانه",
          "lexemeId": "lx-0036"
        },
        {
          "surface": "می‌آیم",
          "lexemeId": "lx-0090"
        }
      ]
    },
    {
      "target": "نان می‌خورم.",
      "translit": "nān mēkhuram.",
      "en": "I eat food.",
      "tokens": [
        {
          "surface": "نان",
          "lexemeId": "lx-0038"
        },
        {
          "surface": "می‌خورم",
          "lexemeId": "lx-0091"
        }
      ]
    },
    {
      "target": "شب خوب است.",
      "translit": "shab khūb ast.",
      "en": "The night is good.",
      "tokens": [
        {
          "surface": "شب",
          "lexemeId": "lx-0041"
        },
        {
          "surface": "خوب",
          "lexemeId": "lx-0063"
        },
        {
          "surface": "است",
          "lexemeId": "lx-0010"
        }
      ]
    }
  ],
  "vocabUsed": [
    "lx-0003",
    "lx-0010",
    "lx-0036",
    "lx-0038",
    "lx-0039",
    "lx-0041",
    "lx-0042",
    "lx-0063",
    "lx-0079",
    "lx-0089",
    "lx-0090",
    "lx-0091"
  ],
  "newWords": [
    "lx-0038",
    "lx-0041",
    "lx-0042",
    "lx-0090",
    "lx-0091"
  ],
  "questions": [
    {
      "questionEn": "What do I drink in the morning?",
      "questionTarget": "صبح چه می‌خورم؟",
      "questionTranslit": "subh che mēkhuram?",
      "options": [
        {
          "target": "چای",
          "translit": "chāy",
          "en": "Tea"
        },
        {
          "target": "شیر",
          "translit": "shīr",
          "en": "Milk"
        },
        {
          "target": "آب",
          "translit": "āb",
          "en": "Water"
        },
        {
          "target": "نان",
          "translit": "nān",
          "en": "Bread"
        }
      ],
      "answerIndex": 0,
      "evidenceSentence": 0,
      "source": "authored"
    },
    {
      "questionEn": "Where do I come at night?",
      "questionTarget": "شب به کجا می‌آیم؟",
      "questionTranslit": "shab ba kujā mēāyam?",
      "options": [
        {
          "target": "به دکان",
          "translit": "ba dukān",
          "en": "To the shop"
        },
        {
          "target": "به بازار",
          "translit": "ba bāzār",
          "en": "To the market"
        },
        {
          "target": "به خانه",
          "translit": "ba khāna",
          "en": "Home"
        },
        {
          "target": "به مکتب",
          "translit": "ba maktab",
          "en": "To school"
        }
      ],
      "answerIndex": 2,
      "evidenceSentence": 2,
      "source": "authored"
    }
  ],
  "grammarPoints": [
    "present-me",
    "prepositions",
    "pronouns-budan"
  ],
  "newWordRatio": 0,
  "source": "seed",
  "createdAt": "2026-07-20T00:00:00.000Z",
  "seq": 2
}
