{
  "id": "tx-seed-l2-027",
  "formatVersion": "1.5.0",
  "level": "L2",
  "titleTarget": "پرواز",
  "titleTranslit": "parwāz",
  "titleEn": "Flight",
  "sentences": [
    {
      "target": "محافظ تغییر را می‌جوید.",
      "translit": "muhāfiz taghyēr rā mējōyad.",
      "en": "The guard seeks the change.",
      "tokens": [
        {
          "surface": "محافظ",
          "lexemeId": "lx-0524"
        },
        {
          "surface": "تغییر",
          "lexemeId": "lx-1049"
        },
        {
          "surface": "را",
          "lexemeId": "lx-0007"
        },
        {
          "surface": "می‌جوید",
          "lexemeId": "lx-0402"
        }
      ]
    },
    {
      "target": "مامان به پرواز می‌رود.",
      "translit": "māmān ba parwāz mērawad.",
      "en": "Mom goes to the flight.",
      "tokens": [
        {
          "surface": "مامان",
          "lexemeId": "lx-0354"
        },
        {
          "surface": "به",
          "lexemeId": "lx-0003"
        },
        {
          "surface": "پرواز",
          "lexemeId": "lx-0587"
        },
        {
          "surface": "می‌رود",
          "lexemeId": "lx-0089"
        }
      ]
    },
    {
      "target": "محافظ مامان را می‌جوید.",
      "translit": "muhāfiz māmān rā mējōyad.",
      "en": "The guard seeks mom.",
      "tokens": [
        {
          "surface": "محافظ",
          "lexemeId": "lx-0524"
        },
        {
          "surface": "مامان",
          "lexemeId": "lx-0354"
        },
        {
          "surface": "را",
          "lexemeId": "lx-0007"
        },
        {
          "surface": "می‌جوید",
          "lexemeId": "lx-0402"
        }
      ]
    },
    {
      "target": "پرواز تغییر می‌کند.",
      "translit": "parwāz taghyēr mēkunad.",
      "en": "The flight changes.",
      "tokens": [
        {
          "surface": "پرواز",
          "lexemeId": "lx-0587"
        },
        {
          "surface": "تغییر",
          "lexemeId": "lx-1049"
        },
        {
          "surface": "می‌کند",
          "lexemeId": "lx-0097"
        }
      ]
    }
  ],
  "vocabUsed": [
    "lx-0003",
    "lx-0007",
    "lx-0089",
    "lx-0097",
    "lx-0354",
    "lx-0402",
    "lx-0524",
    "lx-0587",
    "lx-1049"
  ],
  "newWords": [
    "lx-0354",
    "lx-0402",
    "lx-0524",
    "lx-0587",
    "lx-1049"
  ],
  "questions": [
    {
      "questionEn": "Where does mom go?",
      "questionTarget": "مامان کجا می‌رود؟",
      "questionTranslit": "māmān kujā mērawad?",
      "options": [
        {
          "target": "به مکتب",
          "translit": "ba maktab",
          "en": "To school"
        },
        {
          "target": "به پرواز",
          "translit": "ba parwāz",
          "en": "To the flight"
        },
        {
          "target": "به بازار",
          "translit": "ba bāzār",
          "en": "To the bazaar"
        },
        {
          "target": "به خانه",
          "translit": "ba khāna",
          "en": "Home"
        }
      ],
      "answerIndex": 1,
      "evidenceSentence": 1,
      "source": "authored"
    },
    {
      "questionEn": "Whom does the guard seek?",
      "questionTarget": "محافظ کی را می‌جوید؟",
      "questionTranslit": "muhāfiz kī rā mējōyad?",
      "options": [
        {
          "target": "پدر را",
          "translit": "padar rā",
          "en": "The father"
        },
        {
          "target": "معلم را",
          "translit": "mu'allim rā",
          "en": "The teacher"
        },
        {
          "target": "دوست را",
          "translit": "dōst rā",
          "en": "The friend"
        },
        {
          "target": "مامان را",
          "translit": "māmān rā",
          "en": "Mom"
        }
      ],
      "answerIndex": 3,
      "evidenceSentence": 2,
      "source": "authored"
    }
  ],
  "grammarPoints": [
    "present-me",
    "object-ra",
    "compound-verbs",
    "prepositions"
  ],
  "newWordRatio": 0,
  "source": "seed",
  "createdAt": "2026-07-20T00:00:00.000Z",
  "seq": 27
}
